{
  "schema_version": "sounddecisions-human-curation-items-v1-1.3",
  "instrument_version": "human-eval-round1-curation-1.3",
  "manifest_id": "axis-spec-v2-round1-curation-2026-07-v4",
  "status": "CURATION_AUTHORIZED",
  "default_fps": 30.0,
  "counts": {
    "anchor_curation": 30,
    "two_event_curation": 60,
    "total_tasks": 90,
    "unique_videos": 82
  },
  "items": [
    {
      "blind_id": "HEV2-01FD8E1772BE",
      "tasks": [
        "two_event_curation"
      ],
      "media_path": "media/HEV2-01FD8E1772BE.mp4",
      "fps": 25.0,
      "duration_s": 8.04,
      "candidate_caption": "Two men play a game of tennis, hitting the ball back and forth with their rackets, causing it to bounce on the court."
    },
    {
      "blind_id": "HEV2-043AE58CB747",
      "tasks": [
        "two_event_curation"
      ],
      "media_path": "media/HEV2-043AE58CB747.mp4",
      "fps": 30.0,
      "duration_s": 10.0,
      "candidate_caption": "A character shoots at an opponent from a rooftop before jumping down and building a wooden wall."
    },
    {
      "blind_id": "HEV2-0B9B559443CB",
      "tasks": [
        "two_event_curation"
      ],
      "media_path": "media/HEV2-0B9B559443CB.mp4",
      "fps": 29.97002997002997,
      "duration_s": 10.043,
      "candidate_caption": "A man and woman walk on a wet street corner with their footsteps audible, stopping by a horse as the man sets down a briefcase."
    },
    {
      "blind_id": "HEV2-0CE60718C853",
      "tasks": [
        "two_event_curation"
      ],
      "media_path": "media/HEV2-0CE60718C853.mp4",
      "fps": 29.97,
      "duration_s": 10.01001,
      "candidate_caption": "A character in a video game breaks wooden structures with a pickaxe."
    },
    {
      "blind_id": "HEV2-0E86366C6C12",
      "tasks": [
        "anchor_curation"
      ],
      "media_path": "media/HEV2-0E86366C6C12.mp4",
      "fps": 25.0,
      "duration_s": 10.04,
      "candidate_caption": "A person tests a circuit board with a multimeter, causing short electrical buzzing sounds."
    },
    {
      "blind_id": "HEV2-11B9CAE179D5",
      "tasks": [
        "two_event_curation"
      ],
      "media_path": "media/HEV2-11B9CAE179D5.mp4",
      "fps": 29.97002997002997,
      "duration_s": 10.043,
      "candidate_caption": "A person hammers a large wooden log into a timber frame."
    },
    {
      "blind_id": "HEV2-13762E023CB5",
      "tasks": [
        "two_event_curation"
      ],
      "media_path": "media/HEV2-13762E023CB5.mp4",
      "fps": 29.97002997002997,
      "duration_s": 9.009,
      "candidate_caption": "A man repeatedly slaps a raw steak on a kitchen counter."
    },
    {
      "blind_id": "HEV2-1615DB411EB5",
      "tasks": [
        "anchor_curation"
      ],
      "media_path": "media/HEV2-1615DB411EB5.mp4",
      "fps": 23.976023976023978,
      "duration_s": 9.05,
      "candidate_caption": "A small, furry creature with large eyes makes high-pitched chittering sounds as it peeks out from a dark cave."
    },
    {
      "blind_id": "HEV2-18AA703FF854",
      "tasks": [
        "two_event_curation"
      ],
      "media_path": "media/HEV2-18AA703FF854.mp4",
      "fps": 25.0,
      "duration_s": 10.04,
      "candidate_caption": "People in protective suits open a black bag, producing rustling, thudding, and clicking sounds."
    },
    {
      "blind_id": "HEV2-18ACD3D39681",
      "tasks": [
        "two_event_curation"
      ],
      "media_path": "media/HEV2-18ACD3D39681.mp4",
      "fps": 25.0,
      "duration_s": 10.0,
      "candidate_caption": "An elevator arrives with a ding, the doors open, and a woman walks out."
    },
    {
      "blind_id": "HEV2-26F35D81E749",
      "tasks": [
        "two_event_curation"
      ],
      "media_path": "media/HEV2-26F35D81E749.mp4",
      "fps": 29.97002997002997,
      "duration_s": 10.01,
      "candidate_caption": "A person taps a plastic tube containing a powder on a table in a lab."
    },
    {
      "blind_id": "HEV2-3375ADCF599C",
      "tasks": [
        "two_event_curation"
      ],
      "media_path": "media/HEV2-3375ADCF599C.mp4",
      "fps": 21.226,
      "duration_s": 10.081881,
      "candidate_caption": "A person kicks a football on a field."
    },
    {
      "blind_id": "HEV2-338184E5B84D",
      "tasks": [
        "anchor_curation",
        "two_event_curation"
      ],
      "media_path": "media/HEV2-338184E5B84D.mp4",
      "fps": 23.976,
      "duration_s": 10.01001,
      "candidate_caption": "A man sets down a mug, walks away, and a door is heard opening and closing."
    },
    {
      "blind_id": "HEV2-349C7BE2454A",
      "tasks": [
        "two_event_curation"
      ],
      "media_path": "media/HEV2-349C7BE2454A.mp4",
      "fps": 29.97002997002997,
      "duration_s": 9.042,
      "candidate_caption": "A person uses a metal detector on a beach, which beeps, and then digs in the sand with a shovel."
    },
    {
      "blind_id": "HEV2-38A6717C6A90",
      "tasks": [
        "two_event_curation"
      ],
      "media_path": "media/HEV2-38A6717C6A90.mp4",
      "fps": 24.0,
      "duration_s": 10.041016,
      "candidate_caption": "A character opens a metal grate and then ignites a magical light source."
    },
    {
      "blind_id": "HEV2-3A7CFEAEF852",
      "tasks": [
        "anchor_curation"
      ],
      "media_path": "media/HEV2-3A7CFEAEF852.mp4",
      "fps": 50.0,
      "duration_s": 10.0,
      "candidate_caption": "An electronic scoreboard buzzes after a goal is scored in a women's football match."
    },
    {
      "blind_id": "HEV2-3B956C96C42A",
      "tasks": [
        "two_event_curation"
      ],
      "media_path": "media/HEV2-3B956C96C42A.mp4",
      "fps": 29.97002997002997,
      "duration_s": 10.01,
      "candidate_caption": "Sci-fi gunshots are fired, followed by a magical explosion."
    },
    {
      "blind_id": "HEV2-3CF5EDECF196",
      "tasks": [
        "anchor_curation"
      ],
      "media_path": "media/HEV2-3CF5EDECF196.mp4",
      "fps": 25.0,
      "duration_s": 10.0,
      "candidate_caption": "A man closes a book and gets up from beside a child's bed, causing the bed to creak and his clothes to rustle."
    },
    {
      "blind_id": "HEV2-4189EF7E68BE",
      "tasks": [
        "two_event_curation"
      ],
      "media_path": "media/HEV2-4189EF7E68BE.mp4",
      "fps": 29.97002997002997,
      "duration_s": 10.043,
      "candidate_caption": "A person chops a vegetable on a wooden cutting board, with a dog barking in the background."
    },
    {
      "blind_id": "HEV2-4445DE0A0704",
      "tasks": [
        "anchor_curation",
        "two_event_curation"
      ],
      "media_path": "media/HEV2-4445DE0A0704.mp4",
      "fps": 23.976023976023978,
      "duration_s": 8.008,
      "candidate_caption": "Guests clap for the bride and groom after they kiss at their wedding ceremony."
    },
    {
      "blind_id": "HEV2-44DFA4D96C5C",
      "tasks": [
        "anchor_curation"
      ],
      "media_path": "media/HEV2-44DFA4D96C5C.mp4",
      "fps": 23.976023976023978,
      "duration_s": 10.01,
      "candidate_caption": "A person's body is dropped onto the concrete floor of a parking garage, making a loud thud."
    },
    {
      "blind_id": "HEV2-471D9B318687",
      "tasks": [
        "two_event_curation"
      ],
      "media_path": "media/HEV2-471D9B318687.mp4",
      "fps": 29.97002997002997,
      "duration_s": 10.043,
      "candidate_caption": "Toy cars arrange red strips to spell out the words 'BIRTH DAY' in a stop-motion animation."
    },
    {
      "blind_id": "HEV2-5107D139A4DC",
      "tasks": [
        "two_event_curation"
      ],
      "media_path": "media/HEV2-5107D139A4DC.mp4",
      "fps": 29.97002997002997,
      "duration_s": 10.01,
      "candidate_caption": "Three ceremonial guards perform a synchronized march, their boots stomping rhythmically on a marble floor."
    },
    {
      "blind_id": "HEV2-52E51F279DF5",
      "tasks": [
        "anchor_curation"
      ],
      "media_path": "media/HEV2-52E51F279DF5.mp4",
      "fps": 29.922,
      "duration_s": 10.026068,
      "candidate_caption": "A crow caws as it flies high in the blue sky."
    },
    {
      "blind_id": "HEV2-558E2F11365E",
      "tasks": [
        "two_event_curation"
      ],
      "media_path": "media/HEV2-558E2F11365E.mp4",
      "fps": 30.0,
      "duration_s": 10.0,
      "candidate_caption": "A user creates a new text file by right-clicking and then types to rename it, producing mouse clicks and keyboard sounds."
    },
    {
      "blind_id": "HEV2-55C398408CC6",
      "tasks": [
        "two_event_curation"
      ],
      "media_path": "media/HEV2-55C398408CC6.mp4",
      "fps": 23.976023976023978,
      "duration_s": 8.049,
      "candidate_caption": "Fireworks explode in the night sky over a city."
    },
    {
      "blind_id": "HEV2-5A0DF886184B",
      "tasks": [
        "anchor_curation",
        "two_event_curation"
      ],
      "media_path": "media/HEV2-5A0DF886184B.mp4",
      "fps": 29.97002997002997,
      "duration_s": 9.009,
      "candidate_caption": "Stylized sound effects of an animated character breaking a tree and another adjusting his clothing."
    },
    {
      "blind_id": "HEV2-60CFBC145034",
      "tasks": [
        "two_event_curation"
      ],
      "media_path": "media/HEV2-60CFBC145034.mp4",
      "fps": 29.97,
      "duration_s": 8.008008,
      "candidate_caption": "A person's shoes squeak as they walk across a polished mall floor."
    },
    {
      "blind_id": "HEV2-633500956ABC",
      "tasks": [
        "two_event_curation"
      ],
      "media_path": "media/HEV2-633500956ABC.mp4",
      "fps": 29.97002997002997,
      "duration_s": 8.041,
      "candidate_caption": "A snooker player strikes a red ball, potting it, followed by applause from the crowd."
    },
    {
      "blind_id": "HEV2-67233B363C8A",
      "tasks": [
        "two_event_curation"
      ],